{
  "$schema": "https://json-schema.org/draft/2020-12/schema",
  "title": "TradeoffReceipt",
  "description": "A versioned receipt explaining accepted or rejected tradeoffs (`perfgate.tradeoff.v1`).",
  "type": "object",
  "properties": {
    "baseline_ref": {
      "anyOf": [
        {
          "$ref": "#/$defs/CompareRef"
        },
        {
          "type": "null"
        }
      ]
    },
    "configured_rules": {
      "type": "array",
      "items": {
        "$ref": "#/$defs/TradeoffRule"
      }
    },
    "current_ref": {
      "anyOf": [
        {
          "$ref": "#/$defs/CompareRef"
        },
        {
          "type": "null"
        }
      ]
    },
    "decision": {
      "$ref": "#/$defs/TradeoffDecision"
    },
    "probes": {
      "type": "array",
      "items": {
        "$ref": "#/$defs/TradeoffProbeOutcome"
      }
    },
    "rules": {
      "type": "array",
      "items": {
        "$ref": "#/$defs/TradeoffRuleOutcome"
      }
    },
    "run": {
      "$ref": "#/$defs/RunMeta"
    },
    "scenario": {
      "type": [
        "string",
        "null"
      ]
    },
    "schema": {
      "type": "string"
    },
    "tool": {
      "$ref": "#/$defs/ToolInfo"
    },
    "verdict": {
      "$ref": "#/$defs/Verdict"
    },
    "warnings": {
      "type": "array",
      "items": {
        "type": "string"
      }
    },
    "weighted_deltas": {
      "type": "object",
      "additionalProperties": {
        "$ref": "#/$defs/Delta"
      }
    }
  },
  "required": [
    "schema",
    "tool",
    "run",
    "rules",
    "decision",
    "verdict"
  ],
  "$defs": {
    "CompareRef": {
      "type": "object",
      "properties": {
        "path": {
          "type": [
            "string",
            "null"
          ]
        },
        "run_id": {
          "type": [
            "string",
            "null"
          ]
        }
      }
    },
    "Delta": {
      "type": "object",
      "properties": {
        "baseline": {
          "type": "number",
          "format": "double"
        },
        "current": {
          "type": "number",
          "format": "double"
        },
        "cv": {
          "description": "Coefficient of variation for the current run.",
          "type": [
            "number",
            "null"
          ],
          "format": "double"
        },
        "noise_threshold": {
          "description": "Noise threshold used for this comparison.",
          "type": [
            "number",
            "null"
          ],
          "format": "double"
        },
        "pct": {
          "description": "(current - baseline) / baseline",
          "type": "number",
          "format": "double"
        },
        "ratio": {
          "description": "current / baseline",
          "type": "number",
          "format": "double"
        },
        "regression": {
          "description": "Positive regression amount, normalized as a fraction.",
          "type": "number",
          "format": "double"
        },
        "significance": {
          "anyOf": [
            {
              "$ref": "#/$defs/Significance"
            },
            {
              "type": "null"
            }
          ]
        },
        "statistic": {
          "$ref": "#/$defs/MetricStatistic"
        },
        "status": {
          "$ref": "#/$defs/MetricStatus"
        }
      },
      "required": [
        "baseline",
        "current",
        "ratio",
        "pct",
        "regression",
        "status"
      ]
    },
    "HostInfo": {
      "type": "object",
      "properties": {
        "arch": {
          "description": "CPU architecture (e.g., \"x86_64\", \"aarch64\")",
          "type": "string"
        },
        "cpu_count": {
          "description": "Number of logical CPUs (best-effort, None if unavailable)",
          "type": [
            "integer",
            "null"
          ],
          "format": "uint32",
          "minimum": 0
        },
        "hostname_hash": {
          "description": "Hashed hostname for fingerprinting (opt-in, privacy-preserving).\nWhen present, this is a SHA-256 hash of the actual hostname.",
          "type": [
            "string",
            "null"
          ]
        },
        "memory_bytes": {
          "description": "Total system memory in bytes (best-effort, None if unavailable)",
          "type": [
            "integer",
            "null"
          ],
          "format": "uint64",
          "minimum": 0
        },
        "os": {
          "description": "Operating system (e.g., \"linux\", \"macos\", \"windows\")",
          "type": "string"
        }
      },
      "required": [
        "os",
        "arch"
      ]
    },
    "Metric": {
      "type": "string",
      "enum": [
        "binary_bytes",
        "cpu_ms",
        "ctx_switches",
        "energy_uj",
        "io_read_bytes",
        "io_write_bytes",
        "max_rss_kb",
        "network_packets",
        "page_faults",
        "throughput_per_s",
        "wall_ms"
      ]
    },
    "MetricStatistic": {
      "type": "string",
      "enum": [
        "median",
        "p95"
      ]
    },
    "MetricStatus": {
      "type": "string",
      "enum": [
        "pass",
        "warn",
        "fail",
        "skip"
      ]
    },
    "ProbeScope": {
      "description": "Scope of a named performance probe inside a workload.",
      "type": "string",
      "enum": [
        "local",
        "enclosing",
        "dominant",
        "total"
      ]
    },
    "RunMeta": {
      "type": "object",
      "properties": {
        "ended_at": {
          "type": "string"
        },
        "host": {
          "$ref": "#/$defs/HostInfo"
        },
        "id": {
          "type": "string"
        },
        "started_at": {
          "type": "string"
        }
      },
      "required": [
        "id",
        "started_at",
        "ended_at",
        "host"
      ]
    },
    "Significance": {
      "type": "object",
      "properties": {
        "alpha": {
          "type": "number",
          "format": "double"
        },
        "baseline_samples": {
          "type": "integer",
          "format": "uint32",
          "minimum": 0
        },
        "ci_lower": {
          "type": [
            "number",
            "null"
          ],
          "format": "double"
        },
        "ci_upper": {
          "type": [
            "number",
            "null"
          ],
          "format": "double"
        },
        "current_samples": {
          "type": "integer",
          "format": "uint32",
          "minimum": 0
        },
        "p_value": {
          "type": [
            "number",
            "null"
          ],
          "format": "double"
        },
        "significant": {
          "type": "boolean"
        },
        "test": {
          "$ref": "#/$defs/SignificanceTest"
        }
      },
      "required": [
        "test",
        "alpha",
        "significant",
        "baseline_samples",
        "current_samples"
      ]
    },
    "SignificanceTest": {
      "type": "string",
      "enum": [
        "welch_t"
      ]
    },
    "ToolInfo": {
      "type": "object",
      "properties": {
        "name": {
          "type": "string"
        },
        "version": {
          "type": "string"
        }
      },
      "required": [
        "name",
        "version"
      ]
    },
    "TradeoffAllowance": {
      "description": "A local regression allowance used by a tradeoff rule.",
      "type": "object",
      "properties": {
        "max_regression": {
          "description": "Maximum accepted regression as a ratio.\n\nFor example, `0.03` allows up to a 3% local regression.",
          "type": "number",
          "format": "double"
        },
        "metric": {
          "description": "Metric whose local regression is capped.",
          "$ref": "#/$defs/Metric"
        },
        "probe": {
          "description": "Probe name that is allowed to regress within the configured cap.",
          "type": "string"
        }
      },
      "required": [
        "metric",
        "probe",
        "max_regression"
      ]
    },
    "TradeoffAllowanceOutcome": {
      "description": "Evaluation result for one local regression allowance.",
      "type": "object",
      "properties": {
        "max_regression": {
          "type": "number",
          "format": "double"
        },
        "metric": {
          "type": "string"
        },
        "observed_regression": {
          "type": [
            "number",
            "null"
          ],
          "format": "double"
        },
        "probe": {
          "type": "string"
        },
        "reason": {
          "type": [
            "string",
            "null"
          ]
        },
        "satisfied": {
          "type": "boolean"
        },
        "status": {
          "$ref": "#/$defs/MetricStatus"
        }
      },
      "required": [
        "metric",
        "probe",
        "max_regression",
        "satisfied",
        "status"
      ]
    },
    "TradeoffDecision": {
      "description": "Final structured tradeoff decision.",
      "type": "object",
      "properties": {
        "accepted_tradeoff": {
          "type": "boolean"
        },
        "reason": {
          "type": "string"
        },
        "status": {
          "$ref": "#/$defs/MetricStatus"
        }
      },
      "required": [
        "accepted_tradeoff",
        "status",
        "reason"
      ]
    },
    "TradeoffDecisionStatus": {
      "description": "Outcome of a tradeoff policy decision.",
      "type": "string",
      "enum": [
        "accepted",
        "rejected",
        "not_evaluated"
      ]
    },
    "TradeoffDowngrade": {
      "description": "Target status when a tradeoff rule is satisfied.",
      "type": "string",
      "enum": [
        "warn",
        "pass"
      ]
    },
    "TradeoffProbeOutcome": {
      "description": "Probe-level tradeoff evidence.",
      "type": "object",
      "properties": {
        "deltas": {
          "type": "object",
          "additionalProperties": {
            "$ref": "#/$defs/Delta"
          }
        },
        "name": {
          "type": "string"
        },
        "reason": {
          "type": [
            "string",
            "null"
          ]
        },
        "scope": {
          "anyOf": [
            {
              "$ref": "#/$defs/ProbeScope"
            },
            {
              "type": "null"
            }
          ]
        },
        "status": {
          "$ref": "#/$defs/MetricStatus"
        },
        "weight": {
          "type": [
            "number",
            "null"
          ],
          "format": "double"
        }
      },
      "required": [
        "name",
        "status"
      ]
    },
    "TradeoffRequirement": {
      "description": "A required improvement used by a tradeoff rule.",
      "type": "object",
      "properties": {
        "metric": {
          "description": "Metric that must improve sufficiently for the tradeoff to apply.",
          "$ref": "#/$defs/Metric"
        },
        "min_improvement_ratio": {
          "description": "Minimum required improvement ratio.\n\nFor higher-is-better metrics, this is `current / baseline`.\nFor lower-is-better metrics, this is `baseline / current`.",
          "type": "number",
          "format": "double"
        },
        "probe": {
          "description": "Optional probe name. When set, the requirement is evaluated against\nattached probe comparison evidence instead of weighted scenario deltas.",
          "type": [
            "string",
            "null"
          ]
        }
      },
      "required": [
        "metric",
        "min_improvement_ratio"
      ]
    },
    "TradeoffRequirementOutcome": {
      "description": "Evaluation result for one tradeoff requirement.",
      "type": "object",
      "properties": {
        "metric": {
          "type": "string"
        },
        "observed_change": {
          "type": [
            "number",
            "null"
          ],
          "format": "double"
        },
        "probe": {
          "type": [
            "string",
            "null"
          ]
        },
        "reason": {
          "type": [
            "string",
            "null"
          ]
        },
        "required_change": {
          "type": "number",
          "format": "double"
        },
        "satisfied": {
          "type": "boolean"
        },
        "status": {
          "$ref": "#/$defs/MetricStatus"
        }
      },
      "required": [
        "metric",
        "required_change",
        "satisfied",
        "status"
      ]
    },
    "TradeoffRule": {
      "description": "A structured tradeoff rule for explicit, auditable budget downgrades.",
      "type": "object",
      "properties": {
        "allow": {
          "description": "Optional local regression caps that must remain satisfied.",
          "type": "array",
          "items": {
            "$ref": "#/$defs/TradeoffAllowance"
          }
        },
        "downgrade_to": {
          "description": "Downgrade target when all requirements are satisfied.",
          "$ref": "#/$defs/TradeoffDowngrade",
          "default": "warn"
        },
        "if_failed": {
          "description": "The failed metric that this rule can downgrade.",
          "$ref": "#/$defs/Metric"
        },
        "name": {
          "description": "Unique rule name used in reason tokens.",
          "type": "string"
        },
        "require": {
          "description": "Required compensating improvements.",
          "type": "array",
          "items": {
            "$ref": "#/$defs/TradeoffRequirement"
          },
          "minItems": 1
        }
      },
      "required": [
        "name",
        "if_failed",
        "require"
      ]
    },
    "TradeoffRuleOutcome": {
      "description": "Evaluation result for one named tradeoff rule.",
      "type": "object",
      "properties": {
        "accepted": {
          "type": "boolean"
        },
        "allowances": {
          "type": "array",
          "items": {
            "$ref": "#/$defs/TradeoffAllowanceOutcome"
          }
        },
        "downgrade_to": {
          "anyOf": [
            {
              "$ref": "#/$defs/TradeoffDowngrade"
            },
            {
              "type": "null"
            }
          ]
        },
        "name": {
          "type": "string"
        },
        "reason": {
          "type": [
            "string",
            "null"
          ]
        },
        "requirements": {
          "type": "array",
          "items": {
            "$ref": "#/$defs/TradeoffRequirementOutcome"
          }
        },
        "status": {
          "$ref": "#/$defs/TradeoffDecisionStatus"
        }
      },
      "required": [
        "name",
        "status",
        "accepted"
      ]
    },
    "Verdict": {
      "description": "Overall verdict for a comparison, with pass/warn/fail counts.\n\n# Examples\n\n```\nuse perfgate_types::{Verdict, VerdictStatus, VerdictCounts};\n\nlet verdict = Verdict {\n    status: VerdictStatus::Pass,\n    counts: VerdictCounts { pass: 2, warn: 0, fail: 0, skip: 0 },\n    reasons: vec![],\n};\nassert_eq!(verdict.status, VerdictStatus::Pass);\n\nlet failing = Verdict {\n    status: VerdictStatus::Fail,\n    counts: VerdictCounts { pass: 1, warn: 0, fail: 1, skip: 0 },\n    reasons: vec![\"wall_ms.fail\".into()],\n};\nassert_eq!(failing.status, VerdictStatus::Fail);\nassert!(!failing.reasons.is_empty());\n```",
      "type": "object",
      "properties": {
        "counts": {
          "$ref": "#/$defs/VerdictCounts"
        },
        "reasons": {
          "type": "array",
          "items": {
            "type": "string"
          }
        },
        "status": {
          "$ref": "#/$defs/VerdictStatus"
        }
      },
      "required": [
        "status",
        "counts",
        "reasons"
      ]
    },
    "VerdictCounts": {
      "type": "object",
      "properties": {
        "fail": {
          "type": "integer",
          "format": "uint32",
          "minimum": 0
        },
        "pass": {
          "type": "integer",
          "format": "uint32",
          "minimum": 0
        },
        "skip": {
          "type": "integer",
          "format": "uint32",
          "minimum": 0
        },
        "warn": {
          "type": "integer",
          "format": "uint32",
          "minimum": 0
        }
      },
      "required": [
        "pass",
        "warn",
        "fail",
        "skip"
      ]
    },
    "VerdictStatus": {
      "type": "string",
      "enum": [
        "pass",
        "warn",
        "fail",
        "skip"
      ]
    }
  }
}